idx	branch	parent_commit	commit	recipe	metric	value	elapsed_min	launcher	job_id	command	log_path	status	description
0	async_arc	-	06198fc4	qwen3_1p7b_arc_colocated	grid_match/cell_match/format_valid/accuracy	0.0000/0.5559/0.9419/0.1819	27	launch_experiment.sh	6029953	MODEL=qwen3_1p7b ENV=arc MAX_STEPS=60 bash launch_experiment.sh colocated	6029953-logs/ray-driver.log	keep	baseline: compact digit grids, terse prompt, lr 2e-6, max_new_tokens 4096
1	autoresearch/2026-08-10-arc-prompt/grid-legend-and-verify	06198fc4	b902754e	qwen3_1p7b_arc_colocated	grid_match/cell_match/format_valid/accuracy	0.0736 acc / 0.6279 fmt @ step10	-	launch_experiment.sh	6040390	NUM_ACTOR_NODES=2 MAX_STEPS=12 ... ENV=arc bash launch_experiment.sh colocated	6040390-logs/ray-driver.log	keep	SMOKE: space-delimited cells + color legend + describe-inputs/outputs + self-check prompt, max_new_tokens 8192
2	autoresearch/2026-08-10-arc-prompt/grid-legend-and-verify	b902754e	bc13eb42	qwen3_1p7b_arc_colocated	grid_match/cell_match/format_valid/accuracy	0.0000/0.5251/0.9012/0.1703	-	launch_experiment.sh	6041201	NUM_ACTOR_NODES=8 MAX_STEPS=60 ENV=arc bash launch_experiment.sh colocated	6041201-logs/ray-driver.log	keep	FULL: all four prompt changes + <answer> tags tied to step 5; compare vs baseline 6029953
3	autoresearch/2026-08-10-arc-prompt/copy-relative-reward	bc13eb42	9cb77497	qwen3_1p7b_arc_colocated	grid_match/cell_match/copied_input/accuracy	0.0000/0.5150/0.4012/0.0208	-	launch_experiment.sh	6056499	NUM_ACTOR_NODES=8 MAX_STEPS=60 ENV=arc bash launch_experiment.sh colocated	6056499-logs/ray-driver.log	keep	cell+edit scored as gain over the copy-the-input baseline; new edit-distance term (w=0.10)
4	async_arc	266678f1	40d4b737	qwen3_1p7b_arcsynth_colocated	grid_match(synth L0)/grid_match(real)/mean_reward(synth)/mean_reward(real)	0.7907/0.0000/+1.1097/-0.0019	30	launch_experiment.sh	6070328	MODEL=qwen3_1p7b ENV=arcsynth NUM_ACTOR_NODES=2 MAX_STEPS=20 RUN_TAG=m41_identity EXTRA_OVERRIDES="data.train.levels=[0] grpo.val_at_start=true grpo.val_period=10" bash launch_experiment.sh colocated	6070328-logs/ray-driver.log	keep	M4.1 identity gate. grid_match on synthetic level 0 rises 0.5116 -> 0.6221 -> 0.7907 over 20 steps -- the FIRST nonzero, moving exact-match signal in the campaign. Gate was >0.9: not met at 20 steps, but the climb is steep and monotone and the run was step-capped, not converged, so this is under-training rather than the broken-plumbing failure the gate exists to catch. Real ARC grid_match 0.0000 throughout (expected); real ARC mean reward -0.085 -> -0.002. Profile: idle/buffer_starvation 40-50% of every step -> generation-bound, motivating the buffer_size_gb fix in 61bd3f5e.
5	async_arc	40d4b737	61bd3f5e	qwen3_1p7b_arcsynth_colocated	per-level grid_match (levels 0,1,2) + real ARC	L0 0.897 / L1 0.000 / L2 0.000 / real 0.0000	47	launch_experiment.sh	6072073	SUBMIT_ACCOUNT=nemotron_sw_post MODEL=qwen3_1p7b ENV=arcsynth NUM_ACTOR_NODES=4 MAX_STEPS=60 TIMEOUT_MIN=180 RUN_TAG=m42_levels012 EXTRA_OVERRIDES="data.train.levels=[0,1,2] grpo.val_at_start=true grpo.val_period=10" bash launch_experiment.sh colocated	6072073-logs/ray-driver.log	discard	M4.2 levels 0-2 mixed, 4 nodes, 60 steps. NO GO: level 0 rose 0.586->0.897 and plateaued, levels 1 and 2 never moved. Cause is the mixture, not training: by step 60, 77-79% of L1/L2 answers are the test input echoed verbatim (up from 19-24%), and cell(pred) has converged on cell(echo). Echoing scores the full +1.4 on level 0 -- a third of every batch -- and ~0 on levels 1-2 under the copy-relative reward, so 'always echo' dominates 'attempt and fail'. Level 0 is a gate, not a curriculum level; drop it from the mixture. Throughput: buffer_size_gb 10->40 cut idle/buffer_starvation from 40-50% to 2-11% with weight_sync flat.
6	async_arc	61bd3f5e	46a011f0	qwen3_1p7b_arcsynth_colocated	per-level grid_match / echo rate	L1 0.000 / L2 0.047 / echo 0.69-0.68	50	launch_experiment.sh	6095100	MODEL=qwen3_1p7b ENV=arcsynth NUM_ACTOR_NODES=4 MAX_STEPS=60 RUN_TAG=m42b_levels12 EXTRA_OVERRIDES="data.train.levels=[1,2] grpo.val_at_start=true grpo.val_period=10" bash launch_experiment.sh colocated	6095100-logs/ray-driver.log	discard	M4.2b: drop level 0. NO GO. Echo rate still climbed 22-32% -> 68-69% with cell(pred) at or below cell(echo); grid_match 0.000/0.047. Level 0's payoff was contributory, not causal -- the real mechanism is that an echo is a positive-reward safe harbour (+0.084 from color_recall and format_valid, per §12) while a failed genuine attempt scores cell_gain<0.
7	async_arc	46a011f0	9454a453	qwen3_1p7b_arcsynth_colocated	per-level grid_match / echo / by-area	all levels ~0.000; echo 0.03-0.18	60	launch_experiment.sh	6103019	MODEL=qwen3_1p7b ENV=arcsynth NUM_ACTOR_NODES=4 MAX_STEPS=60 RUN_TAG=m43_sizeramp bash launch_experiment.sh colocated	6103019-logs/ray-driver.log	discard	M4.3: full ladder [1..5], sizes [6,12,20] mixed and ramped. NO GO. The echo did NOT take over (0.03-0.18 vs 0.68-0.79) since levels 3-5 have low cell(echo) -- that part of the diagnosis held. But grid_match flat ~0 everywhere, cell(pred) below cell(echo) on every level, and cell accuracy DECLINED on L4/L5 while parse rate rose to ~1.0. Size hypothesis REFUTED: by-area bucketing shows grid_match 0.000 even under 60 cells at every level bar one (L2 60-150, 1/15). Failure is not per-cell error compounding.
8	async_arc	ec73931f	d5e28d27	nanov3_arcsynth_colocated	per-level grid_match vs qwen (capability control)	PARTIAL: L2 0.057, L3 0.088 @ step 20 of 60	117	launch_experiment.sh	6124839	SUBMIT_ACCOUNT=nemotron_sw_post QOS=normal MODEL=nanov3 ENV=arcsynth NUM_ACTOR_NODES=8 MAX_STEPS=60 TIMEOUT_MIN=180 RUN_TAG=m43_sizeramp bash launch_experiment.sh colocated	6124839-logs/ray-driver.log	crash	Same config on nano-v3, as the capability control for M4.3. Died at the step-20 validation: nano's NeMo-Gym base selects checkpoints on val:total_reward/mean, which the ARC env never emits. Got 3 checkpoints first: L2 0.029->0.057 and L3 0.029->0.088 by step 20, where qwen was flat at 0.000 through 60 -- suggestive, not established (n=34-35, parse rate still climbing 0.09->0.86). Predecessor 6103023 died even earlier on lr 2e-6 < nano's min_lr 3e-6.
